### ISSUE TITLE
Randomize source port for udp packets

### ISSUE THREAD

**Issue by SrX** [DNS-OARC/dnsmeter#28]
Dear dnsmeter team, 

Does it possible to randomize source port for packets that _dnsmeter_ crafts?
At least a couple of different ports?

```
17:20:29.154305 IP mydnsmeterbox.17767 > 8.8.8.8.53: 51510+ A? dom-89680.ch. (30)
17:20:29.154310 IP mydnsmeterbox.17767 > 8.8.8.8.53: 51517+ A? dom-89686.ch. (30)
17:20:29.154315 IP mydnsmeterbox.17767 > 8.8.8.8.53: 51523+ A? dom-89691.ch. (30)
17:20:29.154320 IP mydnsmeterbox.17767 > 8.8.8.8.53: 51528+ A? dom-89696.ch. (30)
```

my bests,

**Comment by yantarou** [comment]
I have a (quick hack) patch for this lying around somewhere that I already forgot about.

If I find some time I'll create an appropriate merge request in the next few days.

**Comment by jelu** [comment]
Hi Serhii, it's going to be a few weeks before I can look at this but it
does look strange indeed.

Jan, thanks! Hope you find the time to send in the PR.

**Comment by jelu** [comment]
I've looked at the code and the source port is randomized unless you're using a PCAP.

@SrX are you using a PCAP?

**Comment by jelu** [comment]
Actually, full command, version and distribution would also help.

**Comment by jelu** [comment]
Oops, read the code a bit too fast. Yeah, there is a static port in there. Will fix.

**Comment by SrX** [comment]
It would be acceptable to use a pool of different ports, like dnsperft does, specifying number of different clients. 
To not impact in dnsmeter performance doing random ports for each query.

**Comment by jelu** [comment]
> It would be acceptable to use a pool of different ports, like dnsperft does, specifying number of different clients.

No, that can not be done.

> To not impact in dnsmeter performance doing random ports for each query.

If you're only using dnsmeter with `-q` then you're not actually using it as it was intended. dnsmeter was created to do very large scale spoofing on private networks where millions of IP addresses and randomized ports would be used.

**Comment by jelu** [comment]
@SrX source port will now be randomized for every packet sent when using `-q`, you can compile the develop branch or use our [pre-release packages](https://dev.dns-oarc.net/packages/). I will do a release in a week or two.
